City,Category,Place Name,Description
Madurai,Forts,Thirumalai Nayakkar Mahal,"A 17th-century palace built by King Thirumalai Nayak, known for its Indo-Saracenic architecture."
Madurai,Monuments,Gandhi Memorial Museum,A museum showcasing artifacts related to Mahatma Gandhi's life and Indian independence movement.
Madurai,Hills & Mountains,Samanar Hills,"Rock-cut caves with Jain inscriptions, offering a serene and historic atmosphere."
Madurai,Beaches,Vaigai River Bank,A scenic riverbank ideal for relaxation and enjoying the view of the Vaigai River.
Madurai,Heritage Sites,Meenakshi Temple,"A historic temple dedicated to Goddess Meenakshi, famous for its Dravidian architecture."
Madurai,Waterfalls,Kutladampatti Falls,"A seasonal waterfall located in a lush green forest, ideal for a short trek."
Madurai,Temples,Alagar Kovil,"A temple dedicated to Lord Vishnu, surrounded by lush green hills and a sacred tank."
Thanjavur,Forts,Thanjavur Palace,"A grand palace built by the Nayak rulers, showcasing Dravidian and Maratha architecture."
Thanjavur,Monuments,Great Living Chola Temples,A UNESCO World Heritage site featuring the Brihadeeswara Temple and other Chola-era structures.
Thanjavur,Hills & Mountains,Punnainallur Mariamman Temple,"A famous temple dedicated to Goddess Mariamman, known for its religious significance."
Thanjavur,Beaches,Manora Fort,"A historical fort built by the Maratha ruler Serfoji II, offering a panoramic view of the sea."
Thanjavur,Heritage Sites,Brihadeeswara Temple,"A UNESCO World Heritage temple dedicated to Lord Shiva, featuring exquisite carvings."
Thanjavur,Waterfalls,Grand Anicut,"An ancient dam built by the Cholas, still serving as a major irrigation source."
Thanjavur,Temples,Thiruvaiyaru,A sacred town known for its music and association with Saint Thyagaraja.
Kanchipuram,Forts,Kailasanathar Temple,A Pallava-era temple known for its intricate carvings and rock-cut architecture.
Kanchipuram,Monuments,Ekambareswarar Temple,"A massive Shiva temple with a towering gopuram, one of the largest in Tamil Nadu."
Kanchipuram,Hills & Mountains,Kanchipuram Fort,"A historic fort from the Vijayanagara period, known for its strategic significance."
Kanchipuram,Beaches,Ulagalantha Perumal Temple,"A temple dedicated to Lord Vishnu in his Trivikrama form, displaying massive deity statues."
Kanchipuram,Heritage Sites,Vedanthangal Bird Sanctuary,"A bird sanctuary home to migratory birds, offering excellent bird-watching opportunities."
Kanchipuram,Waterfalls,Covelong Beach,A picturesque beach known for its clean sands and water sports activities.
Kanchipuram,Temples,Varadaraja Perumal Temple,"A temple dedicated to Lord Vishnu, showcasing impressive Dravidian architecture."
Rameshwaram,Forts,Pamban Bridge,"A historic railway bridge connecting Rameshwaram to the mainland, offering stunning views."
Rameshwaram,Monuments,Ramanathaswamy Temple,"A temple dedicated to Lord Shiva, known for its long corridors and sacred water tanks."
Rameshwaram,Hills & Mountains,Agnitheertham,A revered pilgrimage site where devotees take a holy dip in the sea.
Rameshwaram,Beaches,Dhanushkodi Beach,"A ghost town with ruins from the 1964 cyclone, offering an eerie yet fascinating visit."
Rameshwaram,Heritage Sites,Villoondi Tirtham,"A freshwater spring located near the sea, considered sacred by devotees."
Rameshwaram,Waterfalls,Kothandaramaswamy Temple,"A temple associated with the Ramayana, located near Dhanushkodi."
Rameshwaram,Temples,Jatayu Tirtham,"A sacred site linked to the Ramayana, associated with the mythical bird Jatayu."
Chennai,Forts,Fort St. George,"A 17th-century fort built by the British, now housing a museum and Tamil Nadu's legislative assembly."
Chennai,Monuments,Marina Beach,"India's longest urban beach, popular for its golden sands and vibrant atmosphere."
Chennai,Hills & Mountains,Kapaleeshwarar Temple,"A historic temple dedicated to Lord Shiva, known for its beautiful Dravidian-style architecture."
Chennai,Beaches,Santhome Cathedral,"A cathedral built over the tomb of St. Thomas, one of Jesus' apostles."
Chennai,Heritage Sites,Guindy National Park,"A national park offering a green escape in the heart of Chennai, home to many species."
Chennai,Waterfalls,Valluvar Kottam,"A monument dedicated to the Tamil poet Thiruvalluvar, shaped like a temple chariot."
Chennai,Temples,Elliots Beach,A clean and serene beach known for its peaceful ambiance and food stalls.
Coimbatore,Forts,Dhyanalinga Temple,"A meditation and spiritual center founded by Sadhguru, offering yoga and wellness programs."
Coimbatore,Monuments,Marudhamalai Temple,"A hilltop temple dedicated to Lord Murugan, offering panoramic views of Coimbatore."
Coimbatore,Hills & Mountains,Perur Pateeswarar Temple,"An ancient temple dedicated to Lord Shiva, known for its detailed carvings."
Coimbatore,Beaches,Velliangiri Hills,"A sacred hill range known as the 'Kailash of the South,' popular among trekkers."
Coimbatore,Heritage Sites,Kovai Kutralam Falls,"A scenic waterfall surrounded by thick forests, perfect for nature lovers."
Coimbatore,Waterfalls,Aliyar Dam,A picturesque dam and reservoir offering boating and picnic spots.
Coimbatore,Temples,Siruvani Waterfalls,"A beautiful waterfall located in the Western Ghats, known for its fresh water supply."
